{
    "dataset": "exampleDataset",
    "description": "This is a simple SPARQL example",
    "data": [
        {
            "s": "http://example.org/subject1",
            "p": "http://example.org/predicate1",
            "o": "http://example.org/object1"
        },
        {
            "s": "http://example.org/subject3",
            "p": "http://example.org/predicate3",
            "o": "http://example.org/object3"
        },
        {
            "s": "http://example.org/subject2",
            "p": "http://example.org/predicate2",
            "o": "http://example.org/object2"
        }
    ],
    "queries": [
        {
            "name": "Query 1",
            "description": "Select all triples without sorting. The order of the triples is not guaranteed.",
            "sparql": "SELECT ?s ?p ?o WHERE { ?s ?p ?o }",
            "expected": {
                "result": [
                    {
                        "s": "http://example.org/subject3",
                        "p": "http://example.org/predicate3",
                        "o": "http://example.org/object3"
                    },
                    {
                        "s": "http://example.org/subject1",
                        "p": "http://example.org/predicate1",
                        "o": "http://example.org/object1"
                    },
                    {
                        "s": "http://example.org/subject2",
                        "p": "http://example.org/predicate2",
                        "o": "http://example.org/object2"
                    }
                ],
                "length": 3
            }
        },
        {
            "name": "Query 2",
            "description": "Select all triples sorted by subject ascending.",
            "sparql": "SELECT ?s ?p ?o WHERE { ?s ?p ?o } ORDER BY ?s",
            "expected": {
                "result": [
                    {
                        "s": "http://example.org/subject1",
                        "p": "http://example.org/predicate1",
                        "o": "http://example.org/object1"
                    },
                    {
                        "s": "http://example.org/subject2",
                        "p": "http://example.org/predicate2",
                        "o": "http://example.org/object2"
                    },
                    {
                        "s": "http://example.org/subject3",
                        "p": "http://example.org/predicate3",
                        "o": "http://example.org/object3"
                    }
                ]
            }
        },
        {
            "name": "Query 3",
            "description": "Select all triples sorted by object descending.",
            "sparql": "SELECT ?s ?p ?o WHERE { ?s ?p ?o } ORDER BY DESC(?o)",
            "expected": {
                "result": [
                    {
                        "s": "http://example.org/subject3",
                        "p": "http://example.org/predicate3",
                        "o": "http://example.org/object3"
                    },
                    {
                        "s": "http://example.org/subject2",
                        "p": "http://example.org/predicate2",
                        "o": "http://example.org/object2"
                    },
                    {
                        "s": "http://example.org/subject1",
                        "p": "http://example.org/predicate1",
                        "o": "http://example.org/object1"
                    }
                ],
                "length": 3
            }
        },
        {
            "name": "Query 4",
            "description": "Select all triples sorted by object descending with limited 2.",
            "sparql": "SELECT ?s ?p ?o WHERE { ?s ?p ?o } ORDER BY DESC(?o) LIMIT 2",
            "expected": {
                "result": [
                    {
                        "s": "http://example.org/subject3",
                        "p": "http://example.org/predicate3",
                        "o": "http://example.org/object3"
                    },
                    {
                        "s": "http://example.org/subject2",
                        "p": "http://example.org/predicate2",
                        "o": "http://example.org/object2"
                    }
                ]
            }
        },
        {
            "name": "Query 5",
            "description": "Select all triples and compare by length.",
            "sparql": "SELECT ?s ?p ?o WHERE { ?s ?p ?o }",
            "expected": {
                "length": 3
            }
        }
    ]
}