{
    "dataset": "sharedDataset",
    "description": "Example using SPARQL ASK queries to test specific conditions. Using same dataset as example_2.",
    "data": "example_2/data.ttl",
    "queries": [
        {
            "name": "Query 1",
            "description": "Check if any subject has the predicate 'http://example.org/predicate1' with the object 'http://example.org/object1'.",
            "sparql": "ASK WHERE { ?s <http://example.org/predicate1> <http://example.org/object1> }",
            "expected": {
                "result": true
            }
        },
        {
            "name": "Query 2",
            "description": "Check if there exists a triple with predicate 'http://example.org/predicate3' in the dataset.",
            "sparql": "ASK WHERE { ?s <http://example.org/predicate3> ?o }",
            "expected": {
                "result": true
            }
        },
        {
            "name": "Query 3",
            "description": "Verify if there is a subject with the object 'http://example.org/object5'.",
            "sparql": "ASK WHERE { ?s ?p <http://example.org/object5> }",
            "expected": {
                "result": true
            }
        },
        {
            "name": "Query 4",
            "description": "Confirm whether any triples exist where the object is 'http://example.org/object6'.",
            "sparql": "ASK WHERE { ?s ?p <http://example.org/object6> }",
            "expected": {
                "result": false
            }
        },
        {
            "name": "Query 5",
            "description": "Check if there exists any triple where the subject is 'http://example.org/subject3' and the predicate is not 'http://example.org/predicate4'.",
            "sparql": "ASK WHERE { <http://example.org/subject3> ?p ?o FILTER(?p != <http://example.org/predicate4>) }",
            "expected": {
                "result": true
            }
        }
    ]
}
